{
  "cgsVersion": "0.1.0",
  "kind": "goal",
  "id": "goal_password_reset",
  "createdAt": "2026-07-18T12:00:00Z",
  "title": "Add password reset flow",
  "description": "Allow users to request and complete a password reset.",
  "originalRequest": "Please add password reset.",
  "successCriteria": [
    { "id": "criterion_request", "description": "A user can request a reset email without account enumeration.", "priority": "required" },
    { "id": "criterion_expiry", "description": "Reset tokens expire after the configured duration.", "priority": "required" }
  ],
  "constraints": [{ "id": "constraint_privacy", "description": "Do not reveal whether an email exists.", "category": "security", "required": true }],
  "deliverables": [
    { "id": "deliverable_code", "description": "Password reset implementation", "type": "code", "repositoryPath": "src/auth/reset.ts", "required": true },
    { "id": "deliverable_tests", "description": "Automated password reset tests", "type": "test", "repositoryPath": "tests/auth/reset.test.ts", "required": true }
  ],
  "assumptions": [],
  "permissions": { "allowFileReads": true, "allowFileWrites": true, "allowCommandExecution": true, "allowNetworkAccess": false, "allowDependencyChanges": false, "allowGitOperations": false },
  "clarificationHistory": [],
  "reviewPipeline": {
    "generalReviewer": { "reviewerId": "conduit.general", "required": true },
    "specialistReviewers": [{ "reviewerId": "conduit.testing", "required": true }, { "reviewerId": "conduit.security", "required": true }],
    "routingMode": "hybrid",
    "completionPolicy": "all_required_approve"
  },
  "status": "approved",
  "revision": 1
}
